"link","jenis_pekerjaan","nama_perusahaan","lokasi_perusahaan","kemampuan"
"https://www.techinasia.com/jobs/838dfc41-32e7-40b2-8b51-fe19e0d5ab59","UI/UX Designer","Humata Indonesia","Jakarta, Indonesia (Remote)","Adobe Illustrator, Adobe Photoshop, Adobe Indesign"
"https://www.techinasia.com/jobs/b24c85fc-f19d-4d4f-af59-4f99ba940d7a","Golang Developer - Finance Company","SIGMATECH","Jakarta, Indonesia","Golang, Backend Development, SQL Server, MySQL"
"https://www.techinasia.com/jobs/7ea36153-a086-47fc-99de-b8bdc6a3a351","IT QA Automation - Finance Company","SIGMATECH","Jakarta, Indonesia","Node.js, Test Automation, Selenium, Javascript, Linux"
"https://www.techinasia.com/jobs/c8f8b8d0-5c4b-467d-b1a8-8600420fbab2","Java Developer - Insurance Company","SIGMATECH","Jakarta, Indonesia","Java Apache, Tomcat, Java J2EE, Angular, Javascript"
"https://www.techinasia.com/jobs/94a20b93-f95c-463f-b431-49215b6e9920","Node.JS Developer - Logistic Company","SIGMATECH","Jakarta, Indonesia","Node.js, REST APIs, AJAX, CodeIgniter"
"https://www.techinasia.com/jobs/d16ae293-3e76-4a90-b2de-3eef0e1e3469","Legal Assistant Manager","Halodoc ID","Jakarta, Indonesia","Legal Management, Leadership"
"https://www.techinasia.com/jobs/dcf19c9d-be07-47bc-93f5-3e8b308b4be8","Corporate Analyst","Finku","Jakarta, Indonesia","Product Management, Product Marketing, Business Analysis, Business Intelligence"
"https://www.techinasia.com/jobs/3ff61e60-8844-40c7-999d-daaed40c72c3","Business Manager","Influence ID","Jakarta, Indonesia","Sales & Marketing, Digital Marketing, Business Development, Marketing Communications, Sales Strategy & Management"
"https://www.techinasia.com/jobs/9efae31d-735f-4977-8f95-4121d558a59e","Team Lead .Net Developer","PT. Informasi Teknologi Indonesia","Jakarta, Indonesia",".NET, Java, Team, Leadership"
"https://www.techinasia.com/jobs/b6cdb4f0-17e2-4f6d-87f4-3c0d43bb79d1","Social media Intern (Warung Pintar)","SIRCLO","Tangerang, Indonesia","Social Media, Social Media Marketing, Content Strategy"
"https://www.techinasia.com/jobs/e81bd753-0d68-455f-a4e4-48cd511830d9","Senior Finance Associate","Deliveree Indonesia","Jakarta, Indonesia","Corporate Finance, Planning Financial, Analysis Financial Management"
"https://www.techinasia.com/jobs/e9c1f7c8-cdd4-4a9d-bd04-3593672e854d","Software Documentation / Technical Writer","Jubelio","Jakarta, Indonesia","Databases, Agile, System Administration"
"https://www.techinasia.com/jobs/4d6bc728-8fdb-413a-bf73-f975775d0057","Business Development Manager MAPCLUB","GTech Digital Asia","Jakarta, Indonesia","E-commerce, Business Development & Partnerships, Marketing Strategy, Merchandising, Digital Marketing, Business Development, Communication Skills, Project Management, Retail Management"
"https://www.techinasia.com/jobs/c893391d-864b-4d2b-bbf0-72649771733d","IT Support & Helpdesk","Indocyber Global Teknologi","Jakarta, Indonesia","Networking, Information Technology, Network Security"
"https://www.techinasia.com/jobs/e87736ae-144e-44f6-a851-19982a4b62e9","Corporate Legal Executive","PT Green City Traffic","Kemayoran, Indonesia","Business Operations, Contract, Negotiations Legal"
"https://www.techinasia.com/jobs/80f5c5cc-8d5f-4e43-88af-40ff45f52a05","Manufacturing Finance Accounting Manager","PT Green City Traffic","Kemayoran, Indonesia","SAP, Budgeting, Problem Solving, Asset Management, Financial Management, Inventory Management, Retail Management, Product Management"
"https://www.techinasia.com/jobs/bf60145a-6e43-46fc-a848-80334deb3e82","Senior Backend Developer (Remote/Hybrid)","Jobfonesia","Jakarta, Indonesia (Remote)","C#, .NET, Javascript, jQuery, REST APIs, MySQL, MongoDB"
"https://www.techinasia.com/jobs/c25a6f4d-6528-4532-8264-00247edc77c8","Product Manager (Lending)","KoinWorks","Jakarta, Indonesia","Product Development, Product Management, Product Strategy"
"https://www.techinasia.com/jobs/40e166c2-5413-4b8e-b4f1-0d218cb8af20","IT Project Admin","Indocyber Global Teknologi","Jakarta, Indonesia","Microsoft Word, Attention to Detail, Vendor Management, Microsoft Excel"
"https://www.techinasia.com/jobs/7b6ae815-0bc0-4e3c-a8cc-c13a1abff1d4","Back End Engineer","Jamtangan.com","Jakarta, Indonesia","RESTful Services, REST APIs, Golang"
"https://www.techinasia.com/jobs/a3d400be-14f8-4db3-aeb7-22375bdf6370","Full-stack Engineer","Jamtangan.com","Jakarta, Indonesia","Javascript, PHP, Golang"
"https://www.techinasia.com/jobs/fdd79ca6-b368-4710-8af9-22f3fb8632a2","Software Engineer - Front end","Jamtangan.com","Jakarta, Indonesia","React.js, Javascript, CSS, AngularJS, Vue.js, HTML"
"https://www.techinasia.com/jobs/1d2e473c-f566-4599-b7d6-c183f63019fb","Front end Developer","PT. YUKK Kreasi Indonesia","Tangerang, Indonesia","Mobile UI Design, Front-end Development, Design"
"https://www.techinasia.com/jobs/b21e47cc-cb24-484d-b80f-1572ac00621b","IT Business Analyst Internship (Remote)","SwipeRx (mClinica)","Jakarta, Indonesia (Remote)","Product Development, Product Strategy, Product Research, Agile, Software Development"
"https://www.techinasia.com/jobs/6f6096f0-b5e4-4670-9b8a-27069eee46f0","System Administrator","Sugarlive ID","Serpong, Indonesia (Remote)","Bash, MySQL, VMware Server, Linux System Administration"
"https://www.techinasia.com/jobs/bcdb857b-f906-4070-86ea-d585463866a4","IT Ops and Infrastructure","AKAR INTI ENTERPRISE","Jakarta, Indonesia","Infrastructure, Amazon Web Services (AWS), Javascript, Javascript Frameworks, Cloud Computing"
"https://www.techinasia.com/jobs/2609dce4-10d1-45a3-b897-2410542bf4c8","Android Developer (Augmented Reality/Video Filtering)","SIGMATECH","Jakarta, Indonesia","Object-oriented Programming (OOP), XML, JSON"
"https://www.techinasia.com/jobs/3e07e503-80cb-4e82-a3b3-18d2707d67b6","Java Developer","Indocyber Global Teknologi","Jakarta, Indonesia","MVC, Java, Object-oriented Programming (OOP)"
"https://www.techinasia.com/jobs/785107ef-2dfb-4319-a31d-cdff6e4f0f81","Research Manager","Moladin Digital Indonesia","Jakarta, Indonesia (Remote)","Product Research, Planning Leadership, Problem Solving, Communication Skills, English Language"
"https://www.techinasia.com/jobs/17f85b27-a122-4fe9-aac5-07a34cfc7cd0","Tech Ops","Farmacare","Denpasar, Bali, Indonesia","MySQL, Databases, Data Warehouse, Amazon Web Services (AWS), Javascript, Data Visualization, Python, Golang, Web Applications, Data Management, PostgreSQL, Communication Skills, Cloud Computing"
"https://www.techinasia.com/jobs/89b9258d-60a8-4ae7-b4cb-918410df0676","Quality Engineer / Automation Test Developer","Farmacare","Denpasar, Bali, Indonesia","Test Automation, Web Technologies, Git, Amazon Web Services (AWS), Javascript, Web Services, Web Development, Python, Golang, Selenium, Analytical Skills, Communication Skills"
"https://www.techinasia.com/jobs/118be711-119f-4218-bb94-5c85eec92830","Backend Developer","Farmacare","Denpasar, Bali, Indonesia","MySQL, Git, Amazon Web Services (AWS), Python, Golang, PostgreSQL, SaaS, Communication Skills, Cloud Computing"
"https://www.techinasia.com/jobs/1afc5860-9c70-4ebf-b866-505753e03f18","Frontend developer","Farmacare","Denpasar, Bali, Indonesia","React.js, Git, Amazon Web Services (AWS), Javascript, HTML5, CSS3, REST APIs, SCSS/SASS, Unit Testing, Communication Skills"
"https://www.techinasia.com/jobs/4a268d55-d0c6-4ad2-88bf-11a97de5d342","Product Manager","Makmur","Jakarta, Indonesia","Product Launch, Product Strategy, Product Management, Market Research, User Research"
"https://www.techinasia.com/jobs/33068b2b-ff84-4b49-9d82-eea1ed7d34e7","Project Manager","Oninyon Software Solution","Yogyakarta, Indonesia","Project Management, Jira, Risk Management, Attention to Detail, Teamwork, Problem Solving, Requirements Analysis, Analytics & Reporting, Leadership"
"https://www.techinasia.com/jobs/a0a2fbde-7381-4643-8bee-20e727c239bb","Backend Developer (Golang)","Pintar Ventura Group","Jakarta, Indonesia","Golang, SQL, PostgreSQL, REST APIs"
"https://www.techinasia.com/jobs/a3a1f15f-9edf-456d-9ca0-734411078ee4","Sales Specialist","Refocus","Manila, Philippines (Remote)","Sales & Marketing, Sales Strategy & Management, Marketing Communications, Business Development, Communication Skills, Sales, Sales Training, Inside Sales, Salesforce"
"https://www.techinasia.com/jobs/995f5d22-9103-4c55-aac4-6aa6db6df5a1","Web Frontend Developer (React)","Pintar Ventura Group","Jakarta, Indonesia","React.js, REST APIs, HTML5, CSS3"
"https://www.techinasia.com/jobs/a35d942f-47d3-4dba-98b1-f9c3151308f4","Fleet Vendor Management Associate","Lalamove Logistik Indonesia","Jakarta, Indonesia","Operations, Vendor Management, Sales Strategy & Management"
"https://www.techinasia.com/jobs/4498dc78-2863-4b31-b2ce-5c1f359b8aae","HSE Officer","Octopus Indonesia","Jakarta, Indonesia","Operations Management, Operations Operating Systems"
"https://www.techinasia.com/jobs/b9de1f5d-a2c4-4450-a2a1-00e675c9e641","Senior Software Engineer (Relocation to Malaysia)","SEEK","Kuala Lumpur, Malaysia","Node.js, React.js, Amazon Web Services (AWS), PostgreSQL, MongoDB, Redis"
"https://www.techinasia.com/jobs/6dce00f3-66f8-41e7-b579-be10038c14eb","Account Manager (Recruitment)","Hacktiv8","Jakarta, Indonesia","Business Development & Partnerships, Business Development, Communication Skills"
"https://www.techinasia.com/jobs/25a9e9a4-f89c-4a52-a761-7368539a039a","Senior Software Engineer (Relocation to Melbourne)","SEEK","Melbourne, Australia","Node.js, React.js, Amazon Web Services (AWS), PostgreSQL, MongoDB, Redis"
"https://www.techinasia.com/jobs/741ab064-c6d8-44d3-ac7a-603c65f76612","IT QA Automation - Leasing Industry","SIGMATECH","Tangerang, Indonesia","Automation, QA, SQL"
"https://www.techinasia.com/jobs/f23433ff-2913-4485-b79a-b90618552010","Content Marketing Manager","Bitlabs Academy","Tangerang, Indonesia","Digital Marketing, Marketing Communications, Marketing Strategy, Content Marketing, Communication Skills, Business Analysis, Market Research & Analysis, Market Research, Research & Development (R&D)"
"https://www.techinasia.com/jobs/2f15aafb-a419-4dc3-8017-af3119857aa2","Senior DevOps Engineer","PT. Alpha Indo Soft","Jakarta, Indonesia","DevOps, Amazon Web Services (AWS), Redis, Linux, PostgreSQL, Nginx, Git, Github, Jenkins"
"https://www.techinasia.com/jobs/aaf623aa-e1d2-4daa-b51a-8cb15a5efb33","Junior Database Engineer","PT Bimasakti Multi Sinergi","Sidoarjo, Indonesia","SQL, Ubuntu, Data Management, PostgreSQL, Data Analysis"
"https://www.techinasia.com/jobs/8a04e26d-acd2-4632-9bd4-e215d5929889","Graphic Designer Intern","Rocketindo","Jakarta, Indonesia","Marketing Strategy, Content Marketing, Digital Marketing, Communication Skills, Marketing Communications, Sales & Marketing, Project Management"
"https://www.techinasia.com/jobs/088c75ff-c854-4edd-b509-45e15db590d1","Finance Associate","Rukita","Jakarta, Indonesia","Accounts Payable, Corporate Finance, Data Entry"
"https://www.techinasia.com/jobs/f15267f8-c50f-4718-9b4f-a504dca731e4","Corporate Strategist","Finku","Jakarta, Indonesia","Business Analysis, Business Development, Business Strategy, Communication Skills, Project Management, Analytical Skills, Public Speaking & Presentations"
"https://www.techinasia.com/jobs/ca357489-8582-45b7-ae65-6fc0c1c6876c","Video Production Producer","Refocus","Manila, Philippines","Video Creation, Video Production, Video Editing"
"https://www.techinasia.com/jobs/21a9e3b8-2bba-4e95-827b-a9ddac1e080c","Product Manager","KPay Merchant Service Limited","Hong Kong Central, Hong Kong","Product Management, Business Analysis, Digital Marketing, Business Development, Project Management"
"https://www.techinasia.com/jobs/5bbad5d1-9e5e-446e-bd74-3a1baf9ebb8c","Compliance & Risk Manager","KPay Merchant Service Limited","Singapore, Singapore","Project Management, Business Analysis, Sales Strategy & Management, Product Management"
"https://www.techinasia.com/jobs/4d88c61a-c55e-4988-be3c-6c0fbc2aea8e","Business Development Executive (fintech/payment)","KPay Merchant Service Limited","Singapore, Singapore","Sales & Marketing, Business Development, Business Development & Partnerships, Sales Strategy & Management"
"https://www.techinasia.com/jobs/3592f1cf-9229-4718-b078-445d2f5a311a","Business Strategy Manager","KPay Merchant Service Limited","Hong Kong, Hong Kong","Sales Strategy & Management, Marketing Strategy, Business Development & Partnerships, Business Analysis"
"https://www.techinasia.com/jobs/58bd4883-47b9-437b-9174-13dcac5fc29e","IT Security Network - Insurance Industry","SIGMATECH","Jakarta, Indonesia","Security, Cyber Security, Information Security, Network Security, Information Technology, Networking"
"https://www.techinasia.com/jobs/3e08bc50-8b77-4b7d-abcc-dbf36ae2ce5e","CTO or Senior SW Engineer","WILT VENTURE BUILDER PTE. LTD.","Singapore, Singapore (Remote)","Product Management, Business Development, Cloud Computing, Front-end Development, Backend Development, SaaS, Enterprise Software"
"https://www.techinasia.com/jobs/6bc4cd55-86d5-483d-af89-069aa78489b0","Senior ReactJS Developer","Indocyber Global Teknologi","Jakarta, Indonesia","React.js, Web Development, Front-end Development"
"https://www.techinasia.com/jobs/a03ad2ed-c053-4c3f-955f-7ee5dfbf4983","Project Implementation Officer - Project Manager","Advotics","Jakarta, Indonesia","Business Analysis, Requirements Analysis, Communication Skills, Information Technology, Embedded Systems, Project Management"
"https://www.techinasia.com/jobs/77661c25-5962-4877-a9d0-4c2fe6d44c8c","Sales - Kudus","MyRobin","Kudus, Indonesia","Sales & Marketing, Marketing Communications, Negotiation"
"https://www.techinasia.com/jobs/fadc982e-e9ac-4c28-a0f6-d77b552031e9","Sales Dagangan - Jepara","MyRobin","Jepara, Indonesia","Sales & Marketing, Marketing Communications, Sales Strategy & Management"
"https://www.techinasia.com/jobs/fb6555b8-26c7-4896-84d9-bd1c9642ea5d","Sales - Demak","MyRobin","Demak, Indonesia","Sales & Marketing, Marketing Communications Sales, Strategy & Management"
"https://www.techinasia.com/jobs/7f4c8cc5-3a73-4209-9b0c-66f036d844eb","Data Analyst","Reku (Rekeningku)","Jakarta, Indonesia","Attention to Detail, Databases, CryptoCurrency, SQL ,NoSQL, Data Management, Statistical Analysis, Data Analysis, English Language, Communications, Data Mining"
"https://www.techinasia.com/jobs/1656be91-6de3-4433-8b4e-cff067c3859c","QA Engineer","Gramedia e-Perpust","Jakarta, Indonesia (Remote)","Test Automation, QA, iOS, Development, Python, User Experience (UX) Design, Mobile UI Design, Selenium, Android User Experience (UX), APIs, Usability, Testing Software, Testing Quality Control, Functional Testing"
"https://www.techinasia.com/jobs/486a19ae-2377-4387-9042-e498b8e8314f","Creative Manager","Koltiva","Jakarta, Indonesia","Creative Direction, Adobe Creative, Suite Graphic Design, Video Editing, Photography"
"https://www.techinasia.com/jobs/a8787fb0-fcd5-4053-9462-0681f8eba327","Graphic Designer","Koltiva","Jakarta, Indonesia","Graphic Design, Design Strategy, Experience Design"
"https://www.techinasia.com/jobs/bc73ec0a-45c0-40ec-98c2-36ea820e04df","Content Creator Internship","EMOS GLOBAL DIGITAL","Jakarta, Indonesia","Content Creation, Social Media, Graphic Design"
"https://www.techinasia.com/jobs/4d832211-72a1-469e-9f1f-dd2f0bf5686b","Accounting Supervisor","Halodoc ID","Jakarta, Indonesia","Accounting, Accounts Payable, Management"
"https://www.techinasia.com/jobs/fef36770-7473-45ee-9249-a04e66addd22","Job not found","","",""
"https://www.techinasia.com/jobs/598e08b5-9a3f-4104-bfe3-0367d1cb34e6","Content Developer Freelance","PT Samala Serasi Unggul","Jakarta, Indonesia (Remote)","Microsoft PowerPoint, Communication Skills, Technical Writing"
"https://www.techinasia.com/jobs/e186527d-2c58-4d51-bea0-fc4155620e9a","Sales Medical Representatif","PT YES DOK INDONESIA","Jakarta, Indonesia","Business Development & Partnerships, Sales & Marketing, Sales Strategy & Management, Business Development, Marketing Communications, Marketing Strategy"
"https://www.techinasia.com/jobs/5627e468-943c-4ac6-af96-567508606a5e","Creative Graphic Design","PT Green City Traffic","Kemayoran, Indonesia","Adobe Illustrator, Adobe Photoshop, Video Editing"
"https://www.techinasia.com/jobs/e5faad4c-bfdc-4202-afd6-0aae21b17c2a","Customer Success Specialist - HRIS","Mekari","Jakarta, Indonesia","Account Management, Human Resources, Client Relations"
"https://www.techinasia.com/jobs/8edc6679-5078-43ff-8183-d1f735ea1f0f","Brand Specialist","Aplikasi Super","Jakarta, Indonesia","Brand Management, Branding, Marketing Strategy"
"https://www.techinasia.com/jobs/27b8db75-26fd-419a-9e18-0ef068ea16c3","Operations Intern","Ematic Solutions","Makati City, Philippines","Marketing, Communication Skills, Business Development & Partnerships"
"https://www.techinasia.com/jobs/b17ca46a-91c9-4049-96c7-d6c0219062f0","Content Quality Assurance (Remote)","Jakmall","Jakarta, Indonesia (Remote)","Web Development, Copywriting & Editing"
"https://www.techinasia.com/jobs/a575e715-65ee-4e3c-8f3e-08781ba89dff","Executive Secretary","Pasifik Satelit Nusantara","Jakarta, Indonesia","Microsoft Office, Communication Skills, English Language"
"https://www.techinasia.com/jobs/efe8f8fd-57f4-4b63-b0de-42d568d62397","Field Sales Supervisor - East Java","Jiva","Indonesia Bulk Terminal, Indonesia","Marketing Strategy, Marketing Communications, Sales & Marketing"
"https://www.techinasia.com/jobs/bb401caf-db30-4a9f-bbbe-40572ee48ba4","Sales Associate (Onground)","Rukita","Medan, Sumatra, Indonesia","Sales & Marketing, Communication Skills, Negotiation"
"https://www.techinasia.com/jobs/3cbfc829-1f45-4288-b25a-6b6035b6cb93","Field Sales Supervisor - NTB","Jiva","Indonesia Bulk Terminal, Indonesia","Sales, Strategy & Management Sales, Sales Support, Sales & Marketing"
"https://www.techinasia.com/jobs/4e102e21-5f93-4deb-93de-24351c27de8f","VP of Engineering","99 Group (99.co)","Bandung, Java, Indonesia","Project Management, Communication Skills, Strategy Scrum, Master Scrum, Software Engineering, People Management, Software Architecture, Agile, Software Development, Software Development"
"https://www.techinasia.com/jobs/3b1933bb-de19-43b6-8d5d-df430880409e","Head of Delivery and Engineering Excellence","Moladin Digital Indonesia","Jakarta, Indonesia (Remote)","Scrum, Kanban, Jira, Information Technology ,Scrum Master, Leadership, Analytical Skills, Attention to Detail, Strategic Planning, Problem Solving, Communication Skills"
"https://www.techinasia.com/jobs/cfa2f12f-c3ba-4ace-99c2-3b1da9fa09ec","Quality Assurance Manager","Moladin Digital Indonesia","Jakarta, Indonesia (Remote)","Leadership, Creative, Problem Solving, Attention to Detail, Analytical Skills, Agile, Scrum, English Language, Databases, SQL, APIs, User Interface (UI), Selenium"
"https://www.techinasia.com/jobs/2f2c08b4-7b0f-4003-8c29-a8d2376e7881","Data Engineer","Octopus Indonesia","Jakarta, Indonesia","Amazon Web Services (AWS), Python, Software Engineering, Airflow Coding"
"https://www.techinasia.com/jobs/a301017c-2b5b-49c5-948c-8b9bc89ad83a","Mobile Engineer","Octopus Indonesia","Jakarta, Indonesia","Java, Swift, Design Patterns, APIs, Mobile Development"
"https://www.techinasia.com/jobs/78fde133-47b8-41d5-abcb-2b13e3cefecb","Content Talent Intern","UENA","Jakarta, Indonesia","Marketing Strategy, Social Media Marketing, Digital Marketing"
"https://www.techinasia.com/jobs/f3c33cbf-3937-439b-b0ce-c92fc9d09a30","DevOps Engineer","Octopus Indonesia","Jakarta, Indonesia","Git, Amazon Web Services (AWS), DevOps, Security, PostgreSQL, Compliance, MongoDB"
"https://www.techinasia.com/jobs/f09988cf-f5f6-4192-8b4d-dbae84b89749","Section Head of Creative & TikTok service","Boleh Dicoba Digital","Bandung, Java, Indonesia","Marketing, Marketing Communications, Project Management, Communication Skills, Content Marketing, Creative Direction, Coaching, Design Strategy"
"https://www.techinasia.com/jobs/112d120d-3967-4b8d-a629-4710fed90976","Senior Mobile Engineer","Rukita","Jakarta, Indonesia (Remote)","Android, iOS Development, Mobile Application, React.js, Javascript, Java, Swift, Objective-C, APIs, REST, Scrum"
"https://www.techinasia.com/jobs/61650ef0-5a4b-4ab9-8764-2fbf7290793b","Business Development Manager","Rukita","Medan, Sumatra, Indonesia","Business Development & Partnerships, Microsoft Office, Business Development, Leadership, Communication Skills, Negotiation"
"https://www.techinasia.com/jobs/6974ce70-2f95-484d-9732-0259f557169b","Front End Developer","Scout.inc","Jakarta, Indonesia","MySQL, Python, Front-end Development, Git, Bootstrap"
"https://www.techinasia.com/jobs/660537af-c783-4c3e-a7f3-a9dd02c61aec","Net. Core","Scout.inc","Jakarta, Indonesia","ASP.NET, Apache, Git, TFS, Mechanical Engineering"
"https://www.techinasia.com/jobs/da205688-0d33-47f5-8c33-ee6d3e2a19f1",".Net Developer","Scout.inc","Jakarta, Indonesia","ASP.NET, Javascript, TFS, Git"
"https://www.techinasia.com/jobs/5a99e6c7-ef26-491a-b85a-5f6296477962","System Analyst","Scout.inc","Jakarta, Indonesia","Javascript, SQL Server, Web Development, Git, .NET"
"https://www.techinasia.com/jobs/33ea5ddb-4707-412f-a81a-15b0e1bd5adc","Cloud Engineer","Scout.inc","Jakarta, Indonesia","MySQL, SQL Server, DevOps"
"https://www.techinasia.com/jobs/dcfbbe54-82f4-492c-bf68-2f45f21b6d8b","Security Engineer","Scout.inc","Jakarta, Indonesia","Amazon Web Services (AWS), Bash, PowerShell, MySQL, Cloud Computing"
"https://www.techinasia.com/jobs/ab7ff401-c78d-4e72-97c4-ab1e55307d55","Merchant Acquisition Specialist","MC Payment Indonesia","Jakarta, Indonesia","Sales Business Development, Marketing, Marketing Communications, Sales & Marketing"
"https://www.techinasia.com/jobs/bdeaff73-10f2-4c11-9e3b-df3cce399a5b","Business Analyst","Scout.inc","Jakarta, Indonesia","SQL, MySQL, SQL Server, Statistics"
"https://www.techinasia.com/jobs/7e7ec99c-08e9-4940-bc86-28091b709ce4","Account Executive","PT WIR Asia Tbk","Jakarta, Indonesia","Account Management, Executive Management, Client Relations, Communication Skills"
"https://www.techinasia.com/jobs/b40e612b-0d56-4271-988f-6f60c5a74e8c","Business Operations Lead","Rey.id","Jakarta, Indonesia (Remote)","Sales & Marketing, Business Development, Business Development & Partnerships, Business Model, Innovation Business, Management Business, Operations Business, Plan Business, Strategy New Business, Development Business, Analysis"
"https://www.techinasia.com/jobs/642cfc27-b481-4d5e-9dd1-23e2bf7a3022","Data analyst reviewer","Refocus","Jakarta, Indonesia (Remote)","Python, MySQL, Communication Skills, Microsoft Excel, Microsoft SQL Server, Microsoft Office"
"https://www.techinasia.com/jobs/eb69fff7-4e1a-452e-a90b-f708d72a846b","JMCS Engineer","Ematic Solutions","Makati City, Philippines","Digital Marketing, Project Management, Marketing"
"https://www.techinasia.com/jobs/6694e81d-92c0-444c-9f63-ef0631afd120","Fullstack Payment Gateway Engineer","PT Bimasakti Multi Sinergi","Sidoarjo, Indonesia","PHP, Laravel, REST APIs, MySQL, SDLC"
"https://www.techinasia.com/jobs/44687e1b-9cb7-465a-945e-69055c27af5f","Junior Performance Marketing Consultant","Ematic Solutions","Makati City, Philippines","Sales & Marketing, Digital Marketing, Business Development & Partnerships, Marketing Communications"
"https://www.techinasia.com/jobs/2f0772da-8e58-4b16-8d6b-5519ecf60f3f","Senior DATABASE Engineer","PT. Alpha Indo Soft","Jakarta, Indonesia","Python, Golang, PostgreSQL, SQL, Databases"
"https://www.techinasia.com/jobs/b19d055c-547a-465d-9789-5ae83702c010","Compensation and Benefit Specialist","TADA","Jakarta, Indonesia","Management Payroll, Compensation & Benefits, Analytics Attention to Detail, Microsoft Excel"
"https://www.techinasia.com/jobs/a9461400-69ea-4195-a085-8aa8c4240130","SENIOR GoLang Developer","PT. Alpha Indo Soft","Jakarta, Indonesia","Golang, Jenkins, Web Applications, SQL, PostgreSQL, SQL Server, Amazon Web Services (AWS), NoSQL, Redis, Cassandra, Databases, Design Patterns, RESTful Services"
"https://www.techinasia.com/jobs/1a25aa63-2d96-4055-8a79-506823762818","SENIOR Front End Game Developer","PT. Alpha Indo Soft","Jakarta, Indonesia","Javascript, React.js, Git, HTML, CSS3"
"https://www.techinasia.com/jobs/5c98366d-f98a-4233-8200-e9fae45ef244","Customer Service Specialist","movus technologies","Jakarta, Indonesia","English Language, Customer Service, Communication Skills, Negotiation"
"https://www.techinasia.com/jobs/aae7cd1d-96e1-4672-b70e-01fba34aeda2","2D Animator","PT. Alpha Indo Soft","Jakarta, Indonesia","Unity3D, Adobe After Effects, Adobe Photoshop, Adobe Illustrator"
"https://www.techinasia.com/jobs/f431ee97-17a5-4ce7-b019-177ee8e61ae0","Marketing & Partnership Intern","Topremit","Medan, Sumatra, Indonesia","Negotiation, Communication Skills, English Language, Community Management"
"https://www.techinasia.com/jobs/d8f4067a-0fb3-4d99-890b-071073f2fd47","IT Infrastructure","Halodoc ID","Jakarta, Indonesia","Infrastructure Troubleshooting, Linux System Administration, System Administration, Operating Systems"
"https://www.techinasia.com/jobs/6801cdd9-6f86-43fe-8741-70c92cd2de04","Senior Frontend Engineer","Waresix","Jakarta, Indonesia","React.js, HTML, CSS, Javascript, Vue.js"
"https://www.techinasia.com/jobs/03e717ce-3278-40ec-b595-2a41fc943700","Software Business Analyst","Deliveree Indonesia","Jakarta, Indonesia","Mobile Application, Development, Databases, Problem Solving, Google Apps, User Interface (UI), Analytics & Reporting, SQL, Web Applications, Product Management, Mobile User Experience, Data Analysis, English Language"
"https://www.techinasia.com/jobs/5425c21c-e481-494b-8f3d-a11fe9bdb112","CS Team Leader","Deliveree Indonesia","Jakarta, Indonesia","People Management, Management Customer, Experience Customer, Service Customer, Relationship Management, Quality Control"
